<?xml version="1.0" encoding="Windows-31J"?>
<!DOCTYPE textout PUBLIC "-//F-11 2.0//DTD F11 Textout Configuration//EN"
	"http://f-11.sourceforge.jp/dtds/textoutput10.dtd">

<textout>
	<property name="text" value="{&quot;power_demand&quot;:&quot;" />
	<property name="data" value="P1_D_500_BcdSingle" />
	<property name="text" value="&quot;,&quot;capacity&quot;:&quot;" />
	<property name="data" value="P1_D_501_BcdSingle" />
	<property name="text" value="&quot;,&quot;value&quot;:&quot;" />
	<property name="data" value="P1_D_1900001_Digital" />
	<property name="text" value="&quot;}&#x0D;&#x0A;" />
</textout>
