<?xml version="1.0" encoding="Windows-31J"?>
<!DOCTYPE textout PUBLIC "-//F-11 2.0//DTD F11 Textout Configuration//EN"
	"http://f-11.sourceforge.jp/dtds/textoutput10.dtd">

<textout>
	<property name="text" value="{&quot;demand_forecast&quot;:&quot;" />
	<property name="data" value="P1_D_502_BcdSingle" />
	<property name="text" value="&quot;,&quot;peak_time&quot;:&quot;" />
	<property name="data" value="P1_D_503_BcdSingle" />
	<property name="text" value="Žž‘ä&quot;,&quot;last_update&quot;:&quot;" />
	<property name="data" value="P1_D_504_BcdSingle" />
	<property name="text" value="&quot;}&#x0D;&#x0A;" />
</textout>
